476,,,,,,,,,,,locating and diagnosing faults in electrical systems and equipment,"supervise the preparation of small plant, measuring equipment and tools for permanent way renewal and maintenance"
477,,,,,,,,,,,carrying out fault diagnosis on mechanical equipment,implement and monitor safe working systems for permanent way maintenance or renewal activities
478,,,,,,,,,,,maintaining mechanical equipment,allocate and monitor resources for permanent way engineering activities
479,,,,,,,,,,,carrying out fault diagnosis on electrical equipment and circuits,ensure that the track is fit for operational purposes
480,,,,,,,,,,,maintaining electrical equipment,supervise the permanent way engineering work of a team on site
481,,,,,,,,,,,modifying or rewiring electrical circuits,establish information for signal engineering maintenance and/or fault finding
482,,,,,,,,,,,carrying out fault diagnosis on engineered systems,establish information for signal engineering installation
483,,,,,,,,,,,testing and calibrating instrumentation and control equipment and circuits,determine requirements for the safe access to work locations for signal engineering
484,,,,,,,,,,,leading maintenance activities,reinstate the work area after signal engineering activities
485,,,,,,,,,,,carrying out the testing and calibration of instrumentation control equipment and circuits,assist in the planned maintenance of signalling equipment
486,,,,,,,,,,,carrying out maintenance activities on mechanical equipment,assist in the removal of signalling equipment
487,,,,,,,,,,,carrying out maintenance activities on electrical equipment,assist in the replacement of signalling equipment
488,,,,,,,,,,,carrying out maintenance activities on fluid power equipment,assist with establishing compliance with specifications for signalling equipment
489,,,,,,,,,,,carrying out maintenance activities on instrumentation and control equipment,establish information for signal engineering testing
490,,,,,,,,,,,carrying out maintenance activities on mechanical equipment within an engineered system ,plan signal maintenance testing activities
491,,,,,,,,,,,carrying out maintenance activities on electrical equipment within an engineered system,allocate and monitor resources for signal engineering activities
492,,,,,,,,,,,carrying out maintenance activities on fluid power equipment within an engineered system,carry out planned maintenance of signalling equipment
493,,,,,,,,,,,carrying out maintenance activities on process controller equipment within an engineered system,adjust signalling components and equipment to meet operational requirements
494,,,,,,,,,,,assembling press tools,carry out removal of components from signalling equipment
495,,,,,,,,,,,assembling injection mould tools,carry out replacement of components from signalling equipment
496,,,,,,,,,,,assembling blow mould tools,establish compliance with specifications for signalling equipment
497,,,,,,,,,,,"carrying out fault diagnosis on mould, press tool or die equipment",conduct functional testing of newly installed signalling systems
498,,,,,,,,,,,"maintaining mould, press tool or die equipment",conduct maintenance testing of signalling equipment
499,,,,,,,,,,,"handing over and confirming the completion of mould, press tool or die equipment maintenance activities",conduct specific testing of signalling electronic equipment
500,,,,,,,,,,,"carrying out condition monitoring of mould, press tool or die equipment",transfer responsibility of signalling assets
501,,,,,,,,,,,"carrying out planned maintenance on mould, press tool or die equipment",contribute to technical leadership of signal engineering activities
502,,,,,,,,,,,carrying out planned maintenance on power presses,organise local signal engineering activities
503,,,,,,,,,,,assembling jigs and fixtures using mechanical methods,establish information for telecoms engineering maintenance and/or fault finding
504,,,,,,,,,,,producing sheet metal assemblies,establish information for telecoms engineering installation
505,,,,,,,,,,,assembling components using mechanical fasteners,determine requirements for the safe access to work locations for telecoms engineering
506,,,,,,,,,,,assembling structural steelwork,reinstate the work area after telecoms engineering activities
507,,,,,,,,,,,producing sheetmetal assemblies,assist in the planned maintenance of telecoms equipment
508,,,,,,,,,,,joining fabricated components using mechanical fasteners,assist in the removal of telecoms equipment
509,,,,,,,,,,,producing major structural components/sub-assemblies,assist in the replacement of telecoms equipment
510,,,,,,,,,,,erecting structural steelwork,assist in the tests and checks of telecoms equipment
511,,,,,,,,,,,producing pipe fabrications,establish information for telecoms engineering testing
512,,,,,,,,,,,carrying out the installation of cable runs and circuits in marine structures,plan telecoms maintenance testing activities
513,,,,,,,,,,,assisting in the installation of marine electrical and electronic equipment,allocate and monitor resources for telecoms engineering activities
514,,,,,,,,,,,locating faults in marine electrical and electronic equipment and circuits,carry out planned maintenance of telecoms equipment
515,,,,,,,,,,,carrying out modifications and rewiring of marine electrical circuits,adjust telecoms components and equipment to meet operational requirements
516,,,,,,,,,,,carrying out tests on marine electrical and electronic equipment and circuits,carry out removal of components from telecoms equipment
517,,,,,,,,,,,disconnecting and removing marine electrical and electronic equipment,carry out replacement of components from telecoms equipment
518,,,,,,,,,,,carrying out scheduled maintenance on marine electrical and electronic equipment,establish compliance with specifications for maintained telecoms equipment
519,,,,,,,,,,,assisting in the assembly of marine steelwork components,establish compliance with specifications for newly installed telecoms equipment
520,,,,,,,,,,,assisting in the installation of marine mechanical equipment,conduct specified testing of telecoms systems
521,,,,,,,,,,,locating faults in marine mechanical equipment,transfer responsibility of telecoms assets
522,,,,,,,,,,,carrying out scheduled maintenance on marine mechanical equipment,contribute to technical leadership of telecoms engineering activities
523,,,,,,,,,,,disconnecting and removing marine mechanical equipment,organise local telecoms engineering activities
524,,,,,,,,,,,carrying out maintenance on marine fuel systems and equipment,replace traction and rolling stock communication-electronic systems
525,,,,,,,,,,,carrying out maintenance on marine pneumatic systems and equipment,"support commissioning of plant, equipment and process in food manufacture"
526,,,,,,,,,,,carrying out maintenance on marine auxiliary power units for electrical power generation,take samples and measurements for quality assurance purposes
527,,,,,,,,,,,carrying out maintenance on marine mechanical control equipment and systems,work in an efficient and effective way in the utilities sector
528,,,,,,,,,,,"carrying out maintenance on marine steering gear, control systems and equipment",work with people from other organisations in the utilities sector 
529,,,,,,,,,,,carrying out maintenance on marine lifting equipment,
530,,,,,,,,,,,carrying out maintenance on marine ancillary plant and equipment,
531,,,,,,,,,,,carrying out maintenance on marine steam plant and equipment,
532,,,,,,,,,,,carrying out maintenance on marine liquid ballast systems,
533,,,,,,,,,,,carrying out maintenance on marine fire main systems and equipment,
534,,,,,,,,,,,carrying out maintenance on marine pantry and galley equipment,
535,,,,,,,,,,,producing assemblies of marine wooden components,
536,,,,,,,,,,,fitting marine interior panels and soft furnishings,
537,,,,,,,,,,,fitting marine seating and furniture,
538,,,,,,,,,,,assembling marine composite components,
539,,,,,,,,,,,vacuum forming marine composite materials,
540,,,,,,,,,,,"fitting marine composite components to the vessel, craft or structure",
541,,,,,,,,,,,assembling marine sheet metal components,
542,,,,,,,,,,,assisting in the installation of marine sheet metal components/assemblies,
543,,,,,,,,,,,using mechanical fasteners to join marine sheet metal components,
544,,,,,,,,,,,carrying out tests on marine electrical equipment and circuits,
545,,,,,,,,,,,carrying out the installation of cable runs and circuits in yachts and boats,
546,,,,,,,,,,,assisting in the installation of electrical/electronic equipment in yachts and boats,
547,,,,,,,,,,,assisting in the installation of engine/propulsion systems in yachts and boats,
548,,,,,,,,,,,assisting in the installation of ancillary equipment in yachts and boats,
549,,,,,,,,,,,assisting in the installation of domestic equipment in yachts and boats,
550,,,,,,,,,,,cutting and shaping wooden components for yachts and boats using hand tools,
551,,,,,,,,,,,assisting in the assembly of wooden furniture/outfitting units for yachts and boats,
552,,,,,,,,,,,assisting in the installation of wooden furniture/outfitting units for yachts and boats,
553,,,,,,,,,,,assisting in the assembly of wooden structural components to produce yachts and boats,
554,,,,,,,,,,,"fitting seating, interior panels, soft furnishing and trim in yachts and boats",
555,,,,,,,,,,,assisting in the disconnection and removal of yacht and boat electrical/electronic equipment,
556,,,,,,,,,,,assisting in the disconnection and removal of yacht and boat mechanical and ancillary equipment,
557,,,,,,,,,,,carrying out routine servicing of yacht and boat mechanical and ancillary equipment,
558,,,,,,,,,,,carrying out routine servicing of yacht and boat electrical/electronic equipment,
559,,,,,,,,,,,assisting in modifying and adding electrical circuits in yachts and boats,
560,,,,,,,,,,,check and maintain marina pontoons,
561,,,,,,,,,,,assisting in the installation of wooden furniture/outfitting units in yachts and boats,
562,,,,,,,,,,,overhauling marine electrical power generation and distribution equipment and systems,
563,,,,,,,,,,,installing cable runs and circuits in marine structures,
564,,,,,,,,,,,installing marine power generation and distribution equipment and systems,
565,,,,,,,,,,,installing marine communication equipment and systems,
566,,,,,,,,,,,installing marine navigational equipment and systems,
567,,,,,,,,,,,installing marine sensor equipment and systems,
568,,,,,,,,,,,installing marine computer equipment and systems,
569,,,,,,,,,,,installing marine weapons equipment and systems,
570,,,,,,,,,,,installing marine electrical rotating machines and domestic equipment,
571,,,,,,,,,,,"installing marine lighting, alarm, detection and monitoring equipment and systems",
572,,,,,,,,,,,"setting to work, testing and trialling marine electrical power generation and distribution equipment and systems",
573,,,,,,,,,,,"setting to work, testing and trialling marine communication equipment and systems",
574,,,,,,,,,,,"setting to work, testing and trialling marine navigational equipment and systems",
575,,,,,,,,,,,"setting to work, testing and trialling marine sensor equipment and systems",
576,,,,,,,,,,,"setting to work, testing and trialling marine computer equipment and systems",
577,,,,,,,,,,,"setting to work, testing and trialling marine weapons equipment and systems",
578,,,,,,,,,,,"setting to work, testing and trialling marine electrical rotating machines and domestic equipment",
579,,,,,,,,,,,"setting to work, testing and trialling marine lighting, alarm, detection and monitoring equipment and systems",
580,,,,,,,,,,,diagnosing faults on marine electrical and electronic equipment and circuits,
581,,,,,,,,,,,modifying and rewiring marine electrical circuits,
582,,,,,,,,,,,testing marine electrical and electronic equipment and circuits,
583,,,,,,,,,,,dismantling and removing marine electrical equipment,
584,,,,,,,,,,,maintaining marine electrical power generation and distribution equipment and systems,
585,,,,,,,,,,,maintaining marine communication equipment and systems,
586,,,,,,,,,,,maintaining marine navigational equipment and systems,
587,,,,,,,,,,,maintaining marine sensor equipment and systems,
588,,,,,,,,,,,maintaining marine computer equipment and systems,
589,,,,,,,,,,,maintaining marine weapons equipment and systems,
590,,,,,,,,,,,maintaining marine electrical rotating machines and domestic equipment,
591,,,,,,,,,,,"maintaining marine lighting, alarm, detection and monitoring equipment and systems",
592,,,,,,,,,,,overhauling and repairing marine electrical power generation and distribution equipment and systems,
593,,,,,,,,,,,overhauling and repairing marine communication equipment and systems,
594,,,,,,,,,,,overhauling and repairing marine navigational equipment and systems,
595,,,,,,,,,,,overhauling and repairing marine weapons equipment and systems,
596,,,,,,,,,,,overhauling and repairing marine electrical rotating machines and domestic equipment,
597,,,,,,,,,,,assembling fabricated components to produce marine sub-assemblies,
598,,,,,,,,,,,assembling sub-assemblies and components to produce major marine structural assemblies,
599,,,,,,,,,,,lining off for assembly and erection of marine steelwork and components,
600,,,,,,,,,,,outfitting marine steelwork,
601,,,,,,,,,,,siting and levelling for the assembly of marine structures,
602,,,,,,,,,,,installing marine propulsion systems and equipment,
603,,,,,,,,,,,installing marine power transmission systems and equipment,
604,,,,,,,,,,,installing marine fuel systems and equipment,
605,,,,,,,,,,,installing marine hydraulic systems and equipment,
606,,,,,,,,,,,installing marine pneumatic systems and equipment,
607,,,,,,,,,,,installing marine auxiliary power units for electrical power generation,
608,,,,,,,,,,,installing marine mechanical control systems and equipment,
609,,,,,,,,,,,"installing marine steering gear, control systems and equipment",
610,,,,,,,,,,,installing marine lifting equipment,
611,,,,,,,,,,,installing marine ancillary plant and equipment,
612,,,,,,,,,,,installing marine steam plant and equipment,
613,,,,,,,,,,,installing marine liquid ballast arrangements,
614,,,,,,,,,,,installing marine fire main systems and equipment,
615,,,,,,,,,,,installing marine refrigeration and air conditioning equipment,
616,,,,,,,,,,,installing marine pantry and galley equipment and services,
617,,,,,,,,,,,setting to work and testing marine propulsion systems and equipment,
618,,,,,,,,,,,setting to work and testing marine power transmission systems and equipment,
619,,,,,,,,,,,setting to work and testing marine fuel systems and equipment,
620,,,,,,,,,,,setting to work and testing marine hydraulic systems and equipment,
621,,,,,,,,,,,setting to work and testing marine pneumatic systems and equipment,
622,,,,,,,,,,,setting to work and testing marine auxiliary power ,
623,,,,,,,,,,,setting to work and testing marine mechanical control equipment and systems,
624,,,,,,,,,,,"setting to work and testing marine steering gear, control equipment and systems",
625,,,,,,,,,,,setting to work and testing marine lifting equipment,
626,,,,,,,,,,,setting to work and testing marine ancillary plant and equipment,
627,,,,,,,,,,,setting to work and testing marine steam plant and equipment,
628,,,,,,,,,,,setting to work and testing marine liquid ballast arrangements,
629,,,,,,,,,,,maintaining marine fuel systems and equipment,
630,,,,,,,,,,,maintaining marine hydraulic systems and equipment,
631,,,,,,,,,,,maintaining marine pneumatic systems and equipment,
632,,,,,,,,,,,maintaining marine auxiliary power units,
633,,,,,,,,,,,maintaining marine mechanical control equipment and systems,
634,,,,,,,,,,,"maintaining marine steering gear, control systems and equipment",
635,,,,,,,,,,,maintaining marine lifting equipment,
636,,,,,,,,,,,maintaining marine ancillary plant and equipment,
637,,,,,,,,,,,maintaining marine steam plant and equipment,
638,,,,,,,,,,,maintaining marine liquid ballast arrangements,
639,,,,,,,,,,,maintaining marine fire main systems and equipment,
640,,,,,,,,,,,maintaining marine refrigeration and air conditioning equipment,
641,,,,,,,,,,,maintaining marine pantry and galley equipment and services,
642,,,,,,,,,,,overhauling marine propulsion systems,
643,,,,,,,,,,,overhauling marine power transmission systems,
644,,,,,,,,,,,overhauling marine fuel systems and equipment,
645,,,,,,,,,,,overhauling marine hydraulic systems and equipment,
646,,,,,,,,,,,overhauling marine pneumatic systems and equipment,
647,,,,,,,,,,,overhauling marine auxiliary power units,
648,,,,,,,,,,,overhauling marine mechanical control equipment and systems,
649,,,,,,,,,,,"overhauling marine steering gear, control systems and equipment",
650,,,,,,,,,,,overhauling marine lifting equipment,
651,,,,,,,,,,,overhauling marine ancillary plant and equipment,
652,,,,,,,,,,,overhauling marine steam plant and equipment,
653,,,,,,,,,,,overhauling marine liquid ballast arrangements,
654,,,,,,,,,,,overhauling marine fire main systems and equipment,
655,,,,,,,,,,,overhauling marine refrigeration and air conditioning equipment,
656,,,,,,,,,,,overhauling marine pantry and galley equipment,
657,,,,,,,,,,,assembling marine wooden components,
658,,,,,,,,,,,installing marine wooden components,
659,,,,,,,,,,,installing marine interior panels and soft furnishings,
660,,,,,,,,,,,installing marine seating and furniture,
661,,,,,,,,,,,producing marine composite assemblies,
662,,,,,,,,,,,installing marine composite components,
663,,,,,,,,,,,producing marine sheet metal assemblies,
664,,,,,,,,,,,installing marine sheet metal components and assemblies,
665,,,,,,,,,,,joining marine sheet metal components using mechanical fasteners,
666,,,,,,,,,,,installing cable runs and circuits in yacht and boat structures,
667,,,,,,,,,,,installing electrical equipment in yachts and boats,
668,,,,,,,,,,,installing electronic equipment into yachts and boats,
669,,,,,,,,,,,testing electrical and electronic equipment in yachts and boats,
670,,,,,,,,,,,installing engine/propulsion systems in yachts and boats,
671,,,,,,,,,,,installing ancillary systems and equipment in yachts and boats,
672,,,,,,,,,,,installing domestic systems and equipment in yachts and boats,
673,,,,,,,,,,,testing engine/propulsion systems and mechanical equipment in yachts and boats,
674,,,,,,,,,,,diagnosing faults on marine electrical equipment and circuits,
675,,,,,,,,,,,modifying and rewiring electrical circuits in yachts and boats,
676,,,,,,,,,,,maintaining electrical equipment in yachts and boats,
677,,,,,,,,,,,maintaining electronic equipment in yachts and boats,
678,,,,,,,,,,,servicing engine/propulsion systems in yachts and boats,
679,,,,,,,,,,,servicing ancillary systems and equipment in yachts and boats,
680,,,,,,,,,,,servicing domestic systems and equipment in yachts and boats,
681,,,,,,,,,,,marking out for the manufacture of wooden furniture/outfitting components for yachts and boats,
682,,,,,,,,,,,marking out for the installation of wooden furniture/outfitting units in yachts and boats,
683,,,,,,,,,,,producing/finishing wooden furniture/outfitting components for yachts and,
684,,,,,,,,,,,assembling wooden furniture/outfitting units for yachts and boats,
685,,,,,,,,,,,installing wooden furniture/outfitting units in yachts and boats,
686,,,,,,,,,,,"installing seating, interior panels, soft furnishing and trim in yachts and boats",
687,,,,,,,,,,,installing composite components in yachts and boats,
688,,,,,,,,,,,marking out for the manufacture of structural components for wooden yachts and boats,
689,,,,,,,,,,,lining off for assembly and erection of yacht and boat wooden components,
690,,,,,,,,,,,producing/finishing wooden structural components for yachts and boats,
691,,,,,,,,,,,testing marine electrical equipment and circuits,
692,,,,,,,,,,,assembling/installing wooden structural components to produce yachts and,
693,,,,,,,,,,,producing marine sheet metal outfitting assemblies,
694,,,,,,,,,,,producing marine wooden outfitting assemblies,
695,,,,,,,,,,,installing marine outfitting components and assemblies,
696,,,,,,,,,,,cutting and forming materials to produce hovercraft skirts ,
697,,,,,,,,,,,producing hovercraft skirt assemblies,
698,,,,,,,,,,,installing skirting assemblies onto the hovercraft,
699,,,,,,,,,,,cutting and forming materials to produce rigid inflatable boat (rib) sponsons,
700,,,,,,,,,,,producing rigid inflatable boat (rib) sponson assemblies,
701,,,,,,,,,,,installing sponson assemblies onto the rigid inflatable boat (rib),
702,,,,,,,,,,,"overhauling marine systems, plant and equipment",
703,,,,,,,,,,,reassembling and refitting marine mechanical equipment,
704,,,,,,,,,,,overhauling marine communication equipment and systems,
705,,,,,,,,,,,overhauling marine weapons equipment and systems,
706,,,,,,,,,,,overhauling electrical marine rotating machines and domestic equipment,
707,,,,,,,,,,,setting to work and testing marine power transmission systems and  equipment,
708,,,,,,,,,,,setting to work and testing marine fire main systems and equipment,
709,,,,,,,,,,,setting to work and testing marine refrigeration and air conditioning equipment,
710,,,,,,,,,,,setting to work and testing marine pantry and galley equipment and services,
711,,,,,,,,,,,diagnosing faults on marine mechanical equipment,
712,,,,,,,,,,,carrying out planned maintenance activities on marine mechanical equipment,
713,,,,,,,,,,,carrying out condition monitoring on marine mechanical equipment,
714,,,,,,,,,,,undertake overhead line equipment main steelwork installation under direction,
715,,,,,,,,,,,undertake overhead line equipment small part steelwork installation under direction,
716,,,,,,,,,,,undertake overhead line equipment wiring installation under direction,
717,,,,,,,,,,,"undertake installation of overhead line equipment sectioning, insulation, registration and in-span components under direction",
718,,,,,,,,,,,"undertake installation, enhancement and renewal of overhead line equipment earthing and bonding under direction",
719,,,,,,,,,,,install overhead line equipment main steelwork,
720,,,,,,,,,,,install overhead line equipment small part steelwork,
721,,,,,,,,,,,install overhead line equipment wiring,
722,,,,,,,,,,,"installation of overhead line equipment sectioning, insulation, registration and in-span components",
723,,,,,,,,,,,"install, enhance and renew overhead line equipment earthing and bonding",
724,,,,,,,,,,,using and communicating technical information,
725,,,,,,,,,,,assembling mechanical components,
726,,,,,,,,,,,carrying out routine servicing of mechanical equipment,
727,,,,,,,,,,,assembling fluid power equipment,
728,,,,,,,,,,,wiring electrical equipment and circuits,
729,,,,,,,,,,,assembling electrical wiring support systems,
730,,,,,,,,,,,assembling and wiring electrical panels,
731,,,,,,,,,,,assembling electronic circuits,
732,,,,,,,,,,,carrying out routine servicing of electrical/electronic equipment,
733,,,,,,,,,,,assembling engineering woodwork components,
734,,,,,,,,,,,assembling composite components,
735,,,,,,,,,,,using and communicating technical information,
736,,,,,,,,,,,producing mechanical assemblies,
737,,,,,,,,,,,installing aircraft mechanical fasteners,
738,,,,,,,,,,,producing aircraft detail assemblies,
739,,,,,,,,,,,maintaining mechanical devices and equipment,
740,,,,,,,,,,,assembling and testing fluid power systems,
741,,,,,,,,,,,maintaining fluid power equipment,
742,,,,,,,,,,,wiring and testing electrical equipment and circuits,
743,,,,,,,,,,,forming and assembling electrical cable enclosure and support systems,
744,,,,,,,,,,,"assembling, wiring and testing electrical panels/components mounted in enclosures",
745,,,,,,,,,,,assembling and testing electronic circuits,
746,,,,,,,,,,,maintaining electrical equipment/systems,
747,,,,,,,,,,,maintaining electronic equipment/systems,
748,,,,,,,,,,,maintaining and testing process instrumentation and control devices,
749,,,,,,,,,,,"assembling pattern, model and engineering woodwork components",
750,,,,,,,,,,,diagnosing and rectifying faults on motorsport vehicle systems (during competition),
751,,,,,,,,,,,carrying out maintenance activities on motorsport vehicle electrical equipment,
752,,,,,,,,,,,stripping and rebuilding motorsport engines (pre-competition),
753,,,,,,,,,,,general electrical and electronic engineering applications,
754,,,,,,,,,,,general maintenance engineering applications,
755,,,,,,,,,,,joining public service vehicle components by mechanical processes,
756,,,,,,,,,,,assembling structural sub assemblies to produce a public service vehicle,
757,,,,,,,,,,,fitting sub assemblies and components to public service vehicles,
758,,,,,,,,,,,preparing and manoeuvring armoured fighting vehicles (afvs) for maintenance and transportation  ,
759,,,,,,,,,,,assist in the installation of signalling equipment,
760,,,,,,,,,,,carry out installation of signalling equipment,
761,,,,,,,,,,,diagnose faults in signalling equipment,
762,,,,,,,,,,,assist in the installation of telecoms equipment,
763,,,,,,,,,,,carry out installation of telecoms equipment,
764,,,,,,,,,,,diagnose faults in telecoms equipment,
765,,,,,,,,,,,carry out scheduled maintenance on traction and rolling stock mechanical equipment,
766,,,,,,,,,,,carry out scheduled maintenance on traction and rolling stock electrical equipment,
767,,,,,,,,,,,carry out scheduled maintenance on traction and rolling stock fluid power equipment,
768,,,,,,,,,,,carry out scheduled maintenance on traction and rolling stock communication-electronic equipment,
769,,,,,,,,,,,assist in the installation of traction and rolling stock equipment,
770,,,,,,,,,,,hand over and confirm completion of traction and rolling stock maintenance activities,
771,,,,,,,,,,,carry out fault diagnosis on traction and rolling stock systems,
772,,,,,,,,,,,maintain mechanical equipment within a traction and rolling stock system,
