146,,,,,,fettling cast components,marking out marine sheet metalwork,,,,producing aircraft engine combustion assemblies,implement the complex repair of explosive substances and/or articles
147,,,,,,applying coatings or coverings to finish surfaces,cutting and shaping marine sheet metal using hand and machine tools,,,,producing aircraft engine turbine assemblies,implement the routine repair of explosive substances and/or articles
148,,,,,,applying surface treatments,bending and forming marine sheet metal using hand and machine tools,,,,producing aircraft engine gearbox assemblies,plan configuration activities for explosive substances and/or articles
149,,,,,,applying heat treatment to engineering materials,cutting and shaping materials using cnc laser profiling machines,,,,producing aircraft piston engine assemblies,manage configuration activities for explosive substances and/or articles
150,,,,,,producing composite mouldings using wet lay-up techniques,cutting and shaping using cnc plasma or gas cutting machines,,,,producing aircraft engine major assemblies,implement configuration activities for explosive substances and/or articles
151,,,,,,producing composite mouldings using pre-preg techniques,using resistance spot welding to join marine sheet metal materials,,,,dressing aircraft engines,audit the effectiveness of configuration activities for explosive substances and/or articles
152,,,,,,producing and preparing sand moulds and cores for casting,joining marine materials/structures using the manual metal arc (mma) welding process,,,,installing aircraft hydraulic systems,manage the maintenance programme for explosive substances and/or articles
153,,,,,,producing cast components by manual means,joining marine materials/structures using semi-automatic mig/mag and flux cored arc processes,,,,installing aircraft pneumatic systems,manage the maintenance plan for explosive substances and/or articles
154,,,,,,"fettling, finishing and checking cast components",joining marine materials/structures using manual tig and plasma-arc welding processes,,,,installing aircraft de-icing systems,implement the inspection of explosive substances and/or articles
155,,,,,,finishing surfaces by applying coatings or coverings,joining marine materials/structures using the manual oxy/fuel gas welding process,,,,installing aircraft fuel systems,implement the adjustment of explosive substances and/or articles
156,,,,,,finishing surfaces by applying treatments,joining materials using manual torch brazing and soldering,,,,installing aircraft environmental systems,implement the complex removal of explosive substances and/or articles
157,,,,,,carrying out heat treatment of engineering materials,welding materials using mechanised arc welding equipment,,,,installing flying control surfaces and systems,implement the routine removal of explosive substances and/or articles
158,,,,,,,cutting and shaping wooden components for yachts and boats using machines,,,,installing aircraft armament systems,implement the complex assembly of explosive substances and/or articles
159,,,,,,,bending and forming marine pipe using hand methods,,,,installing aircraft assisted escape mechanisms,implement the routine assembly of explosive substances and/or articles
160,,,,,,,bending and forming marine pipe using bending machines,,,,installing aircraft main engines,identify the requirement and specification for explosive substances and/or articles
161,,,,,,,assembling ferrous marine pipework by mechanical means,,,,installing aircraft auxiliary engines,define the procurement strategy for explosive substances and/or articles
162,,,,,,,assembling non-ferrous marine pipework,,,,installing aircraft power transmission systems,contribute to the identification of the requirement and specification for explosive substances and/or articles
163,,,,,,,assembling non-metallic marine pipework,,,,testing installed aircraft engines,identify potential suppliers of explosive substances and/or articles
164,,,,,,,installing marine pipework and components,,,,testing aircraft power transmission systems,provide explosives-related technical input to assist in identifying potential suppliers and/or articles
165,,,,,,,preparing and testing marine pipework systems,,,,testing aircraft hydraulic systems,negotiate and award contracts for explosives substances and/or articles
166,,,,,,,producing socket and flange fillet welded joints in pipe using a manual welding process,,,,testing aircraft pneumatic systems,place orders for the supply of explosive substances and/or articles
167,,,,,,,joining marine pipework by manual torch brazing and soldering,,,,testing aircraft environmental systems,manage the contract for the supply of explosive substances and/or articles
168,,,,,,,surveying marine pipework systems,,,,testing aircraft de-icing systems,ensure compliance with contract terms for the supply of explosive substances and/or articles
169,,,,,,,marking off marine structural steelwork components,,,,testing aircraft fuel systems,move explosive substances and/or articles manually
170,,,,,,,cutting and shaping materials using portable thermal cutting equipment,,,,testing aircraft flying control surfaces and systems,manage the receipt of explosive substances and/or articles
171,,,,,,,cutting materials using hand and machine tools,,,,testing aircraft armament systems,manage the storage of explosive substances and/or articles
172,,,,,,,forming marine components using power rolling machines,,,,testing aircraft assisted escape systems,manage the despatch of explosive substances and/or articles
173,,,,,,,forming marine components using a power press,,,,installing aircraft cableforms/looms,manage stock levels and stock inventories of explosive substances and/or articles
174,,,,,,,loading and proving cnc fabrication machine tool programs,,,,installing aircraft instrument panels and meters,audit stock levels and stock inventories for explosive substances and/or articles
175,,,,,,,carrying out cnc fabrication machine tool programming,,,,installing aircraft visual display units and computer systems,carry out stock checks of explosive substances and/or articles
176,,,,,,,setting cnc fabrication machines for production operations,,,,installing aircraft engine control units,maintain stock control systems for explosive substances and/or articles
177,,,,,,,operating cnc fabrication machines,,,,installing aircraft power supplies,operate specialized plant and machinery to performance requirements for explosive substances and/or articles
178,,,,,,,bending and straightening material using the heat-line method,,,,installing aircraft communication systems,supervise the placing of explosive substances and/or articles into storage
179,,,,,,,tack welding marine plate using a manual/semi-automatic welding process,,,,installing aircraft flight guidance and control systems,put explosive substances and/or articles into storage
180,,,,,,,carrying out pattern development for marine applications,,,,installing aircraft navigational systems,supervise the receiving of explosive substances and/or articles into storage
181,,,,,,,marking out for the manufacture and assembly of marine wooden components,,,,installing aircraft radar systems,supervise the maintenance of storage conditions for explosive substances and/or articles
182,,,,,,,marking out for the installation of marine wooden assemblies,,,,installing aircraft countermeasure systems,maintain the quality of explosive substances and/or articles in storage
183,,,,,,,producing marine wooden components using hand tools,,,,installing aircraft electro-optical and infrared systems,select and prepare explosive substances and/or articles for despatch
184,,,,,,,producing marine wooden components using machines,,,,installing aircraft instrumentation systems,despatch explosive substances and/or articles
185,,,,,,,producing marine soft furnishings,,,,modifying aircraft electrical systems,"supervise the selection, preparation and despatch of explosive substances and/or articles"
186,,,,,,,marking out for fabrication and assembly of marine sheet metalwork,,,,modifying aircraft avionics systems,couple and uncouple the train
187,,,,,,,cutting sheet metal to shape using hand and machine tools,,,,testing aircraft cableforms/looms,plan and manage the safe and secure transportation by road of explosive substances and articles
188,,,,,,,forming marine sheet metal components using hand and machine tools,,,,testing aircraft visual display units and computer systems,plan and manage the safe and secure transportation by rail of explosive substances and articles
189,,,,,,,producing fillet welded joints using a manual/semi-automatic welding process,,,,testing aircraft engine control units,plan and manage the safe and secure transportation by sea of explosive substances and articles
190,,,,,,,joining marine sheet metal materials using resistance spot welding,,,,testing aircraft communication systems,plan and manage the safe and secure transportation by air of explosive substances and articles
191,,,,,,,welding marine materials and structures using the manual metal arc process,,,,testing aircraft flight guidance and control systems,define explosives facilities requirement
192,,,,,,,welding marine materials and structures using semi-automatic mig/mag and,,,,testing aircraft navigational systems,ensure explosives facilities are fit for purpose
193,,,,,,,welding marine materials and structures using manual tig and plasma arc welding processes,,,,testing aircraft radar systems,conduct safety checks on explosives facilities
194,,,,,,,welding marine materials and structures using the manual oxy/fuel gas,,,,testing aircraft countermeasure systems,develop and implement the explosives facility decommissioning plan
195,,,,,,,welding marine pipe/tube using multiple manual arc welding processes,,,,test aircraft electro-optical and infrared systems,conduct decommissioning tasks on explosives facility
196,,,,,,,welding marine plate and structures using multiple manual arc welding processes,,,,testing aircraft instrumentation systems,prepare materials for processing according to instructions
197,,,,,,,joining marine materials by manual torch brazing and soldering,,,,producing aircraft wiring layouts and routeings,prepare to start up a machine-based production process
198,,,,,,,preparing mechanised arc welding equipment for production,,,,"producing aircraft electrical sub-assemblies, cableforms and looms",start up and maintain a machine-based production process
199,,,,,,,welding materials with mechanised arc welding equipment,,,,modifying aircraft cableforms and looms,shutdown a machine-based production process
200,,,,,,,"preparing resistance spot, seam and projection welding machines for production",,,,carrying out maintenance of aircrew protective helmets and electrical headsets,select and prepare used products for processing
201,,,,,,,"welding materials using resistance spot, seam and projection welding machines",,,,carrying out maintenance of aircrew protective clothing,prepare to produce products by hand-based operations
202,,,,,,,preparing laser welding machines for production,,,,"carrying out maintenance of aircrew nuclear, biological and chemical (nbc) respirators and equipment",finish products
203,,,,,,,welding materials using laser welding machines,,,,carrying out maintenance of aircrew life preserver equipment,maintain stocks to specified levels
204,,,,,,,preparing electron beam welding machines for production,,,,carrying out maintenance of aircrew inertia reels and restraint harnesses,contribute to the improvement of routine working practices
205,,,,,,,welding materials using electron beam welding machines,,,,carrying out maintenance of aircraft multi-seat life rafts and emergency packs,configure and set processing systems to meet production requirements
206,,,,,,,preparing friction welding machines for production,,,,carrying out maintenance of aircrew oxygen masks,optimise standard operations which are under process control
207,,,,,,,welding materials using friction welding machines,,,,carrying out maintenance of aircrew personal survival packs (psp),evaluate and modify processing parameters to meet process operations
208,,,,,,,preparing brazing machines for production,,,,carrying out maintenance of aircrew quick-release fasteners (qrf),carry out complex manual operations
209,,,,,,,joining materials using brazing machines,,,,carrying out maintenance of ejection seat headbox parachute assemblies,evaluate and adjust manual operations
210,,,,,,,producing wooden furniture/outfitting components for yachts and boats using,,,,testing uninstalled aircraft assisted escape system (aaes) components,carry out complex sampling operations
211,,,,,,,producing wooden structural components for yachts and boats using machines,,,,testing installed aircraft armament systems,carry out testing operations
212,,,,,,,marking out for the manufacture and installation of marine outfitting components,,,,testing uninstalled aircraft armament system components,lead the work of teams and individuals to achieve their objective
213,,,,,,,producing marine outfitting components in wood based materials,,,,undertaking fault diagnosis on installed aircraft armament systems,plan polymer process activities
214,,,,,,,producing marine outfitting components in sheet metal,,,,undertaking fault diagnosis on uninstalled aircraft armament system components,"meet safety, health and environmental requirements in the workplace for the polymer industry"
215,,,,,,,producing patterns for hovercraft skirts,,,,modifying aircraft armament systems and components,contribute to the efficiency and effectiveness of work
216,,,,,,,producing patterns for rigid inflatable boat (rib) sponsons,,,,overhauling aircraft gun systems,establish and maintain effective working relationships in polymer processing and related operations
217,,,,,,,tack welding marine plate using a manual welding process,,,,overhauling aircraft assisted escape systems (aaes),rectify process problems
218,,,,,,,machining components using grinding machines,,,,overhauling aircraft armament release systems,contribute to a machine-based processing operation
219,,,,,,,producing components by manual machining,,,,removing aircraft armament system components,carry out a hand-based processing operation
220,,,,,,,marking out wood and composite materials,,,,removing aircraft assisted escape systems (aaes),finish production components
221,,,,,,,making components using hand tools and fitting techniques,,,,removing aircraft armament expendable stores,pack and store production components
222,,,,,,,carrying out pipe fitting activities,,,,installing aircraft armament system components,"accept, verify and store materials required for process operations"
223,,,,,,,using lathes for turning operations,,,,installing aircraft assisted escape systems (aaes),unit 1: prepare materials for processing according to instructions within polymer processing and related operations
224,,,,,,,using milling machines,,,,installing aircraft armament expendable stores,unit 10: supply materials required for process operations within polymer processing and related operations
225,,,,,,,using grinding machines,,,,carrying out fault diagnosis on aircraft avionics components or systems,unit 12: start up and maintain a machine-based production process within polymer processing and related operations
226,,,,,,,cutting and shaping platework components,,,,undertaking scheduled maintenance of aircraft avionics equipment/systems,unit 13: shutdown a machine-based production process within polymer processing and related operations
227,,,,,,,using oxy-fuel gas cutting equipment,,,,removing and replacing avionic indication and gauging components in aircraft systems,unit 15: prepare to produce products by hand-based operations within polymer processing and related operations
228,,,,,,,using manual metal arc welding equipment,,,,"removing and replacing components of aircraft electrical power control, distribution and protection systems",unit 16: produce products using hand-based operations within polymer processing and related operations
229,,,,,,,using manual tig welding equipment,,,,removing and replacing components of aircraft pitot static systems,unit 17: finish products within polymer processing and related operations
230,,,,,,,using semi-automatic mig or mag welding equipment,,,,removing and replacing components of aircraft armament systems,unit 18: inspect products within polymer processing and related operations
231,,,,,,,using manual oxy-fuel gas welding equipment,,,,removing and replacing components of aircraft communication systems,unit 19: prepare to configure processing equipment within polymer processing and related operations
232,,,,,,,using manual flame brazing and soldering equipment,,,,removing and replacing components of aircraft passive warning and optical/surveillance systems,unit 20: configure processing equipment within polymer processing and related operations
233,,,,,,,making components from wood-based materials,,,,removing and replacing components of aircraft radar systems,unit 22: carry out simple sampling operations within polymer processing and related operations
234,,,,,,,producing components using hand fitting techniques,,,,removing and replacing components of aircraft navigational and computing systems,unit 23: carry out simple testing operations within polymer processing and related operations
235,,,,,,,forming and assembling pipework systems,,,,removing and replacing components of aircraft internal and external lighting systems,unit 25: contribute to the improvement of routine working practices within polymer processing and related operations
236,,,,,,,carrying out aircraft detail fitting activities,,,,modifying aircraft avionic systems,unit 28: pick polymer stock and make up orders within polymer processing and related operations
237,,,,,,,preparing and using lathes for turning operations,,,,carrying out tests on avionic indication and gauging components of aircraft systems,unit 29: configure and set processing systems to meet production requirements within polymer processing and related operations
238,,,,,,,preparing and using milling machines,,,,"carrying out tests on aircraft electrical power control, distribution and protection systems",unit 31: evaluate and modify processing parameters to meet process operations within polymer processing and related operations
239,,,,,,,preparing and using grinding machines,,,,carrying out tests on aircraft pitot static systems,unit 32: carry out complex manual operations within polymer processing and related operations
240,,,,,,,preparing and proving cnc machine tool programs,,,,carrying out tests on aircraft communication systems,unit 34: carry out complex sampling operations within polymer processing and related operations
241,,,,,,,preparing and using cnc turning machines,,,,carrying out tests on aircraft passive warning and optical/surveillance systems,unit 35: carry out testing operations within polymer processing and related operations
242,,,,,,,preparing and using cnc milling machines,,,,carrying out tests on aircraft radar systems,unit 38: plan polymer process activities within polymer processing and related operations
243,,,,,,,preparing and using cnc machining centres,,,,carrying out tests on aircraft navigational and computing systems,unit 4: prepare for a processing operation within polymer processing and related operations
244,,,,,,,preparing and using industrial robots,,,,carrying out tests on aircraft flight guidance and control systems,unit 40: establish and maintain effective working relationships within polymer processing and related operations
245,,,,,,,producing platework components and assemblies,,,,"carrying out fault diagnosis on aircraft airframe, mechanical components and systems",unit 46: contribute to the continuous improvement of the business within polymer processing and related operations
246,,,,,,,cutting and shaping materials using thermal cutting equipment,,,,undertaking scheduled maintenance of aircraft airframe and mechanical equipment,unit 47: rectify process problems within polymer processing and related operations
247,,,,,,,preparing and proving cnc fabrication machine tool programs,,,,removing and replacing aircraft power plant and components,unit 5: contribute to a machine-based processing
248,,,,,,,preparing and using cnc fabrication machinery,,,,removing and replacing components of aircraft control systems,unit 6: carry out a hand-based processing
249,,,,,,,preparing and using manual metal arc welding equipment,,,,removing and replacing components of aircraft fuel and lubrication systems,unit 7: finish production components within
250,,,,,,,preparing and using manual tig or plasma-arc welding equipment,,,,removing and replacing components of aircraft hydraulic systems,unit 8: pack and store production components
251,,,,,,,"preparing and using semi-automatic mig, mag and flux cored arc welding equipment",,,,removing and replacing components of aircraft pneumatic and vacuum systems,"unit 9: accept, verify and store materials required"
252,,,,,,,preparing and using manual flame brazing and braze  welding equipment,,,,removing and replacing components of aircraft environmental systems,control delivery of utility network activities against operational plans and quality requirements
253,,,,,,,wiring and testing programmable controller based systems,,,,removing and replacing components of aircraft power transmission systems,install metal decking and edge trims
254,,,,,,,"using wood for pattern, modelmaking and other engineering applications",,,,"removing and replacing components of aircraft cabin systems, equipment and furnishings",install studs by stud welding
255,,,,,,,producing components by rapid prototyping techniques,,,,removing and replacing major assemblies of aircraft airframes,manage and oversee the quality of work
256,,,,,,,"general machining, fitting and assembly applications",,,,modifying aircraft propulsion equipment and systems,maintain and develop own technical and operational engineering expertise related to electricity network assets
257,,,,,,,trace the route of water pipes and locate surface fittings and street furniture,,,,carrying out tests on aircraft engines and systems,commission assets on the electricity network
258,,,,,,,,,,,carrying out tests on aircraft control systems,de-commission assets on the electricity network
259,,,,,,,,,,,carrying out tests on aircraft fuel and storage systems,configure electricity networks to asset owner's requirements
260,,,,,,,,,,,carrying out tests on aircraft hydraulic systems,determine the requirements for operations and maintenance of electricity network assets
261,,,,,,,,,,,carrying out tests on aircraft pneumatic and vacuum systems,schedule operations and maintenance activities on electricity network assets
262,,,,,,,,,,,carrying out tests on aircraft environmental systems,investigate incidents relating to electricity network assets
263,,,,,,,,,,,carrying out tests on aircraft power transmission systems,build and manage teams
264,,,,,,,,,,,carrying out checks and tests on replaced airframe major assemblies,manage finance for your area of responsibility
265,,,,,,,,,,,carrying out test bed runs on aircraft engines (uninstalled),obtain the resources to carry out work on electricity network assets
266,,,,,,,,,,,overhauling aircraft gas turbine engines by module replacement,implement work on electricity network assets
267,,,,,,,,,,,overhauling aircraft gas turbine engine compressor assemblies,evaluate operational processes used on electricity network assets
268,,,,,,,,,,,overhauling aircraft gas turbine engine combustion assemblies,solve electricity network engineering problems with engineering solutions
269,,,,,,,,,,,overhauling aircraft gas turbine engine turbine assemblies,specify methods and procedures to operate and maintain electricity network assets
270,,,,,,,,,,,overhauling aircraft gas turbine engine gearbox assemblies,establish and maintain effective working relationships on gas network construction sites 
271,,,,,,,,,,,overhauling aircraft piston engines,install engineering components and assets in gas network construction
272,,,,,,,,,,,"overhauling components of aircraft rotor heads, blades and power transmission equipment",conduct specified testing of gas network engineering components and assets in gas network construction
273,,,,,,,,,,,overhauling components of aircraft hydraulic equipment,conduct and commission specified connections to gas network assets
274,,,,,,,,,,,"overhauling components of aircraft pneumatic, vacuum and environmental equipment",determine technical requirements needed to achieve objectives in gas network construction operations
275,,,,,,,,,,,overhauling components of aircraft oxygen equipment,determine resource requirements needed to achieve objectives in gas network construction
276,,,,,,,,,,,overhauling components of aircraft fuel and lubrication equipment,plan engineering activities for gas network construction
277,,,,,,,,,,,overhauling major components of aircraft airframes,co-ordinate communications for operational activities on utility networks and assets
278,,,,,,,,,,,overhauling components of aircraft navigational and computing equipment,contribute to the handling of incidents and resources in the utilities sector
279,,,,,,,,,,,overhauling components of aircraft communication equipment,contribute to an effective and safe working environment in the utilities sector
280,,,,,,,,,,,overhauling components of aircraft radar equipment,monitor and respond to alarms on utility networks and assets
281,,,,,,,,,,,overhauling components of aircraft indication and gauging equipment,contribute to developing and maintaining positive caller relationships in the utilities sector
