,lenght,avg dist,0,1,2,3,4,5,6,7,8,9,10,11,12,13,14,15,16,17,18,19,20,21,22,23,24,25,26,27,28,29,30,31,32,33,34,35,36,37,38,39,40,41,42,43,44,45,46,47,48,49
73,2,0.24,rail engineering overhead line equipment construction suite 2,rail engineering overhead line equipment construction suite 3,,,,,,,,,,,,,,,,,,,,,,,,,,,,,,,,,,,,,,,,,,,,,,,,
76,2,0.272,performing engineering operations suite 1 2006,performing engineering operations suite 2 2006,,,,,,,,,,,,,,,,,,,,,,,,,,,,,,,,,,,,,,,,,,,,,,,,
83,2,0.285,aeronautical engineering suite 2,aeronautical engineering suite 3,,,,,,,,,,,,,,,,,,,,,,,,,,,,,,,,,,,,,,,,,,,,,,,,
88,3,0.31,heating and ventilating,plumbing and domestic heating,refrigeration and air conditioning,,,,,,,,,,,,,,,,,,,,,,,,,,,,,,,,,,,,,,,,,,,,,,,
29,3,0.353,gas network construction,multi utility network construction,network construction operations,,,,,,,,,,,,,,,,,,,,,,,,,,,,,,,,,,,,,,,,,,,,,,,
2,3,0.36,construction site management,construction site supervision,occupational work supervision construction,,,,,,,,,,,,,,,,,,,,,,,,,,,,,,,,,,,,,,,,,,,,,,,
74,5,0.364,rail engineering,rail engineering signalling suite 2,rail engineering signalling suite 3,rail engineering telecoms suite 2,rail engineering telecoms suite 3,,,,,,,,,,,,,,,,,,,,,,,,,,,,,,,,,,,,,,,,,,,,,
3,50,0.37,accessing operations and rigging construction,applied waterproof membranes construction,associated industrial services occupations construction,building maintenance multi trade repair and refurbishment operations,chimney engineering construction,cladding occupations construction,construction and civil engineering operations,construction design management coordination level 4 nos,construction diving operations,construction operations and civil engineering services construction,construction operations construction,construction plant or machinery maintenance,construction using off site manufactured assemblies,controlling lifting operations construction,decorative finishing and industrial painting occupations construction,demolition construction,erection of precast concrete construction,floorcovering occupations construction,formwork construction,heritage skills construction,highways maintenance construction,innovative modern methods of construction,insulation and building treatments construction,interior systems construction,mastic asphalt construction,metal decking and stud welding occupations,piling operations construction,plant operations construction,plastering construction,post tensioning operations construction,refractory installation construction,removal of hazardous and non hazardous waste construction,road building and maintenance,roofing occupations construction,senior crafts construction,site logistics operations construction,specialist concrete occupations,specialist concrete occupations construction,specialist installation occupations construction,stonemasonry construction,sub structure work occupations construction,super structure work occupations construction,trowel occupations construction,tunnelling operations construction,wall and floor tiling construction,waterproof membrane roofing systems,waterproof membrane roofing systems construction,wood occupations construction,wood preserving industrial pre treatment construction,woodmachining construction sawmilling extrusion furniture
10,2,0.383,providing advice on securities or derivatives in the non retail market,providing advice on securities or derivatives in the retail market,,,,,,,,,,,,,,,,,,,,,,,,,,,,,,,,,,,,,,,,,,,,,,,,
99,2,0.409,precast concrete operations,production of glass supporting fabrications,,,,,,,,,,,,,,,,,,,,,,,,,,,,,,,,,,,,,,,,,,,,,,,,
82,2,0.414,electrical and electronic engineering suite 3,electrical and electronic engineering suite 3 2004,,,,,,,,,,,,,,,,,,,,,,,,,,,,,,,,,,,,,,,,,,,,,,,,
9,4,0.418,pension scheme trusteeship,pension trustee board secretaryship,secretary to the trustees of pension funds,trustee and management committee,,,,,,,,,,,,,,,,,,,,,,,,,,,,,,,,,,,,,,,,,,,,,,
45,2,0.463,harbour masters,supervision of port operations,,,,,,,,,,,,,,,,,,,,,,,,,,,,,,,,,,,,,,,,,,,,,,,,
96,2,0.464,"fenestration, installation and surveying",glazing,,,,,,,,,,,,,,,,,,,,,,,,,,,,,,,,,,,,,,,,,,,,,,,,
43,2,0.471,hospitality management,hospitality supervision and leadership,,,,,,,,,,,,,,,,,,,,,,,,,,,,,,,,,,,,,,,,,,,,,,,,
50,3,0.481,directors,production accounting,senior producers,,,,,,,,,,,,,,,,,,,,,,,,,,,,,,,,,,,,,,,,,,,,,,,
69,12,0.485,constructing capital plant steel structures erecting,fabricating steel structures plating,"installation, testing and commissioning of electrical systems and equipment plant",installing plant and systems mechanical,installing plant and systems pipefitting,maintaining plant and systems electrical,maintaining plant and systems instrument and controls,maintaining plant and systems mechanical,monitoring engineering construction activities,supporting activities in engineering construction,welding plate and pipework,welding supervision,,,,,,,,,,,,,,,,,,,,,,,,,,,,,,,,,,,,,,
80,6,0.493,engineering maintenance and installation suite 2 2008,engineering maintenance suite 3 2008,installation and commissioning suite 3,installation and commissioning suite 3 2003,rail engineering traction and rolling stock suite 2,rail engineering traction and rolling stock suite 3,,,,,,,,,,,,,,,,,,,,,,,,,,,,,,,,,,,,,,,,,,,,
30,3,0.497,electricity network control engineer,gas networks engineering management,utilities network planning and management,,,,,,,,,,,,,,,,,,,,,,,,,,,,,,,,,,,,,,,,,,,,,,,
77,2,0.503,composite engineering suite 2,composite engineering suite 3,,,,,,,,,,,,,,,,,,,,,,,,,,,,,,,,,,,,,,,,,,,,,,,,
14,4,0.506,general insurance,general takaful,insurance technicians supervisors,london market,,,,,,,,,,,,,,,,,,,,,,,,,,,,,,,,,,,,,,,,,,,,,,
44,5,0.515,engineering maintenance in food manufacture,food business operational management,food business strategic leadership,production management,supply chain management,,,,,,,,,,,,,,,,,,,,,,,,,,,,,,,,,,,,,,,,,,,,,
46,2,0.521,"inspectors of health, social care, children and young peoples services",leadership and management for care services,,,,,,,,,,,,,,,,,,,,,,,,,,,,,,,,,,,,,,,,,,,,,,,,
78,6,0.53,engineering and manufacture suite 4,engineering leadership and management suite 4,engineering leadership and management suite 5,engineering leadership suite 3,engineering technical support suite 2 2007,engineering technical support suite 3 2009,,,,,,,,,,,,,,,,,,,,,,,,,,,,,,,,,,,,,,,,,,,,
57,4,0.531,built environment design and consultancy practice,construction contracting operations management,construction senior management,site inspection,,,,,,,,,,,,,,,,,,,,,,,,,,,,,,,,,,,,,,,,,,,,,,
61,5,0.561,expedition leadership and management,management and leadership,managing in road passenger transport,outdoor sector senior roles,professional skills for government psg,,,,,,,,,,,,,,,,,,,,,,,,,,,,,,,,,,,,,,,,,,,,,
84,14,0.568,automotive engineering suite 3,engineering toolmaking level 3,engineering toolmaking suite 3,engineering toolmaking suite 3 2005,"engineering woodworking, pattern and model making suite 3 2002",fabrication and welding engineering suite 3,fabrication and welding suite 2,marine engineering,marine engineering suite 2,marine engineering suite 3,mechanical manufacturing engineering suite 2 2008,mechanical manufacturing engineering suite 3 2008,performing engineering operations suite 1,performing engineering operations suite 2,,,,,,,,,,,,,,,,,,,,,,,,,,,,,,,,,,,,
17,2,0.599,credit management,financing and credit,,,,,,,,,,,,,,,,,,,,,,,,,,,,,,,,,,,,,,,,,,,,,,,,
1,2,0.62,temporary traffic management construction,traffic management,,,,,,,,,,,,,,,,,,,,,,,,,,,,,,,,,,,,,,,,,,,,,,,,
39,2,0.628,sport and play surfaces level 2,sport and play surfaces level 3,,,,,,,,,,,,,,,,,,,,,,,,,,,,,,,,,,,,,,,,,,,,,,,,
15,5,0.63,bank accounts,customer payments for financial products and services,financial services sales process,investment operations,"life, pensions and investments",,,,,,,,,,,,,,,,,,,,,,,,,,,,,,,,,,,,,,,,,,,,,
58,4,0.644,building services engineering technology and project management,electrotechnical services electrotechnical technology and project management,"project control, estimating, planning and cost engineering",project management,,,,,,,,,,,,,,,,,,,,,,,,,,,,,,,,,,,,,,,,,,,,,,
97,2,0.654,engineered wood,"solid surface fabrication, installation and templating",,,,,,,,,,,,,,,,,,,,,,,,,,,,,,,,,,,,,,,,,,,,,,,,
53,2,0.672,emergency fire services management,watch management,,,,,,,,,,,,,,,,,,,,,,,,,,,,,,,,,,,,,,,,,,,,,,,,
49,2,0.677,combined working practices,polymer processing and related operations,,,,,,,,,,,,,,,,,,,,,,,,,,,,,,,,,,,,,,,,,,,,,,,,
35,2,0.679,cctv strategic and operational management,security management,,,,,,,,,,,,,,,,,,,,,,,,,,,,,,,,,,,,,,,,,,,,,,,,
40,2,0.682,leisure management,managing sport and active leisure 2006,,,,,,,,,,,,,,,,,,,,,,,,,,,,,,,,,,,,,,,,,,,,,,,,
89,2,0.707,down stream gas,mechanical engineering services,,,,,,,,,,,,,,,,,,,,,,,,,,,,,,,,,,,,,,,,,,,,,,,,
102,1,1.0,precast and prestressed concrete operations,,,,,,,,,,,,,,,,,,,,,,,,,,,,,,,,,,,,,,,,,,,,,,,,,
67,1,1.0,treatment processing and control in the water industry,,,,,,,,,,,,,,,,,,,,,,,,,,,,,,,,,,,,,,,,,,,,,,,,,
100,1,1.0,"installation of domestic fascias, soffits and bargeboards",,,,,,,,,,,,,,,,,,,,,,,,,,,,,,,,,,,,,,,,,,,,,,,,,
101,1,1.0,performing building products operations,,,,,,,,,,,,,,,,,,,,,,,,,,,,,,,,,,,,,,,,,,,,,,,,,
66,1,1.0,fisheries management,,,,,,,,,,,,,,,,,,,,,,,,,,,,,,,,,,,,,,,,,,,,,,,,,
70,1,1.0,design and draughting,,,,,,,,,,,,,,,,,,,,,,,,,,,,,,,,,,,,,,,,,,,,,,,,,
65,1,1.0,agricultural management,,,,,,,,,,,,,,,,,,,,,,,,,,,,,,,,,,,,,,,,,,,,,,,,,
71,1,1.0,installing plant and systems small bore tubing occupations,,,,,,,,,,,,,,,,,,,,,,,,,,,,,,,,,,,,,,,,,,,,,,,,,
68,1,1.0,systems operations and management,,,,,,,,,,,,,,,,,,,,,,,,,,,,,,,,,,,,,,,,,,,,,,,,,
86,1,1.0,land based engineering operations,,,,,,,,,,,,,,,,,,,,,,,,,,,,,,,,,,,,,,,,,,,,,,,,,
98,1,1.0,wood merchants,,,,,,,,,,,,,,,,,,,,,,,,,,,,,,,,,,,,,,,,,,,,,,,,,
85,1,1.0,bus and coach engineering and maintenance,,,,,,,,,,,,,,,,,,,,,,,,,,,,,,,,,,,,,,,,,,,,,,,,,
95,1,1.0,air tightness testing,,,,,,,,,,,,,,,,,,,,,,,,,,,,,,,,,,,,,,,,,,,,,,,,,
94,1,1.0,ensuring the compliance of electrical installation work in dwellings with the building regulations england and wales,,,,,,,,,,,,,,,,,,,,,,,,,,,,,,,,,,,,,,,,,,,,,,,,,
93,1,1.0,electrotechnical services instrumentation,,,,,,,,,,,,,,,,,,,,,,,,,,,,,,,,,,,,,,,,,,,,,,,,,
75,1,1.0,rail operations supervisory,,,,,,,,,,,,,,,,,,,,,,,,,,,,,,,,,,,,,,,,,,,,,,,,,
92,1,1.0,electrotechnical services approved electrician status,,,,,,,,,,,,,,,,,,,,,,,,,,,,,,,,,,,,,,,,,,,,,,,,,
91,1,1.0,integrated systems engineering,,,,,,,,,,,,,,,,,,,,,,,,,,,,,,,,,,,,,,,,,,,,,,,,,
90,1,1.0,oil fired technical services,,,,,,,,,,,,,,,,,,,,,,,,,,,,,,,,,,,,,,,,,,,,,,,,,
79,1,1.0,engineering leadership and management suite 3,,,,,,,,,,,,,,,,,,,,,,,,,,,,,,,,,,,,,,,,,,,,,,,,,
81,1,1.0,electrical and electronic servicing,,,,,,,,,,,,,,,,,,,,,,,,,,,,,,,,,,,,,,,,,,,,,,,,,
87,1,1.0,engineering surveying operations,,,,,,,,,,,,,,,,,,,,,,,,,,,,,,,,,,,,,,,,,,,,,,,,,
72,1,1.0,welding pipework,,,,,,,,,,,,,,,,,,,,,,,,,,,,,,,,,,,,,,,,,,,,,,,,,
64,1,1.0,management of volunteers 2008,,,,,,,,,,,,,,,,,,,,,,,,,,,,,,,,,,,,,,,,,,,,,,,,,
52,1,1.0,grips and crane technicians,,,,,,,,,,,,,,,,,,,,,,,,,,,,,,,,,,,,,,,,,,,,,,,,,
62,1,1.0,managing justice sector services,,,,,,,,,,,,,,,,,,,,,,,,,,,,,,,,,,,,,,,,,,,,,,,,,
25,1,1.0,countering financial crime,,,,,,,,,,,,,,,,,,,,,,,,,,,,,,,,,,,,,,,,,,,,,,,,,
24,1,1.0,accountancy and finance,,,,,,,,,,,,,,,,,,,,,,,,,,,,,,,,,,,,,,,,,,,,,,,,,
23,1,1.0,risk management for the financial sector,,,,,,,,,,,,,,,,,,,,,,,,,,,,,,,,,,,,,,,,,,,,,,,,,
22,1,1.0,marketing 2013,,,,,,,,,,,,,,,,,,,,,,,,,,,,,,,,,,,,,,,,,,,,,,,,,
21,1,1.0,business continuity management 2014,,,,,,,,,,,,,,,,,,,,,,,,,,,,,,,,,,,,,,,,,,,,,,,,,
20,1,1.0,land based operations,,,,,,,,,,,,,,,,,,,,,,,,,,,,,,,,,,,,,,,,,,,,,,,,,
19,1,1.0,branch management and business and customer commercial relationship management,,,,,,,,,,,,,,,,,,,,,,,,,,,,,,,,,,,,,,,,,,,,,,,,,
18,1,1.0,anti money laundering,,,,,,,,,,,,,,,,,,,,,,,,,,,,,,,,,,,,,,,,,,,,,,,,,
16,1,1.0,financial services core competences,,,,,,,,,,,,,,,,,,,,,,,,,,,,,,,,,,,,,,,,,,,,,,,,,
13,1,1.0,investment strategy and management,,,,,,,,,,,,,,,,,,,,,,,,,,,,,,,,,,,,,,,,,,,,,,,,,
12,1,1.0,providing financial advice and financial planning,,,,,,,,,,,,,,,,,,,,,,,,,,,,,,,,,,,,,,,,,,,,,,,,,
11,1,1.0,paraplanning,,,,,,,,,,,,,,,,,,,,,,,,,,,,,,,,,,,,,,,,,,,,,,,,,
8,1,1.0,providing advice on savings for retirement,,,,,,,,,,,,,,,,,,,,,,,,,,,,,,,,,,,,,,,,,,,,,,,,,
7,1,1.0,generic financial advice,,,,,,,,,,,,,,,,,,,,,,,,,,,,,,,,,,,,,,,,,,,,,,,,,
6,1,1.0,fencing,,,,,,,,,,,,,,,,,,,,,,,,,,,,,,,,,,,,,,,,,,,,,,,,,
5,1,1.0,plant installation construction,,,,,,,,,,,,,,,,,,,,,,,,,,,,,,,,,,,,,,,,,,,,,,,,,
4,1,1.0,plant operations extractives,,,,,,,,,,,,,,,,,,,,,,,,,,,,,,,,,,,,,,,,,,,,,,,,,
26,1,1.0,bulk explosive truck operations,,,,,,,,,,,,,,,,,,,,,,,,,,,,,,,,,,,,,,,,,,,,,,,,,
63,1,1.0,building products leadership,,,,,,,,,,,,,,,,,,,,,,,,,,,,,,,,,,,,,,,,,,,,,,,,,
27,1,1.0,explosive substances and articles,,,,,,,,,,,,,,,,,,,,,,,,,,,,,,,,,,,,,,,,,,,,,,,,,
31,1,1.0,leakage detection and control,,,,,,,,,,,,,,,,,,,,,,,,,,,,,,,,,,,,,,,,,,,,,,,,,
60,1,1.0,integrated logistic support ils management suite 4 2003,,,,,,,,,,,,,,,,,,,,,,,,,,,,,,,,,,,,,,,,,,,,,,,,,
59,1,1.0,industrial design,,,,,,,,,,,,,,,,,,,,,,,,,,,,,,,,,,,,,,,,,,,,,,,,,
56,1,1.0,multi utility management skills,,,,,,,,,,,,,,,,,,,,,,,,,,,,,,,,,,,,,,,,,,,,,,,,,
55,1,1.0,"health, safety and environmental management in the extractive and mineral processing industries",,,,,,,,,,,,,,,,,,,,,,,,,,,,,,,,,,,,,,,,,,,,,,,,,
54,1,1.0,fibreboard operations,,,,,,,,,,,,,,,,,,,,,,,,,,,,,,,,,,,,,,,,,,,,,,,,,
103,1,1.0,solar thermal photovoltaic panel installation and surveying,,,,,,,,,,,,,,,,,,,,,,,,,,,,,,,,,,,,,,,,,,,,,,,,,
51,1,1.0,live events and promotions management,,,,,,,,,,,,,,,,,,,,,,,,,,,,,,,,,,,,,,,,,,,,,,,,,
48,1,1.0,offshore wind and marine installation and commissioning,,,,,,,,,,,,,,,,,,,,,,,,,,,,,,,,,,,,,,,,,,,,,,,,,
47,1,1.0,long term conditions case management,,,,,,,,,,,,,,,,,,,,,,,,,,,,,,,,,,,,,,,,,,,,,,,,,
42,1,1.0,activity leadership,,,,,,,,,,,,,,,,,,,,,,,,,,,,,,,,,,,,,,,,,,,,,,,,,
41,1,1.0,leisure management l3 2005,,,,,,,,,,,,,,,,,,,,,,,,,,,,,,,,,,,,,,,,,,,,,,,,,
38,1,1.0,security and loss prevention,,,,,,,,,,,,,,,,,,,,,,,,,,,,,,,,,,,,,,,,,,,,,,,,,
37,1,1.0,securing void properties,,,,,,,,,,,,,,,,,,,,,,,,,,,,,,,,,,,,,,,,,,,,,,,,,
36,1,1.0,mechanical fire protection,,,,,,,,,,,,,,,,,,,,,,,,,,,,,,,,,,,,,,,,,,,,,,,,,
34,1,1.0,utilities control centre operations,,,,,,,,,,,,,,,,,,,,,,,,,,,,,,,,,,,,,,,,,,,,,,,,,
33,1,1.0,confined spaces,,,,,,,,,,,,,,,,,,,,,,,,,,,,,,,,,,,,,,,,,,,,,,,,,
32,1,1.0,utility infrastructure management,,,,,,,,,,,,,,,,,,,,,,,,,,,,,,,,,,,,,,,,,,,,,,,,,
28,1,1.0,mines management,,,,,,,,,,,,,,,,,,,,,,,,,,,,,,,,,,,,,,,,,,,,,,,,,
104,1,1.0,mechanical ride operation,,,,,,,,,,,,,,,,,,,,,,,,,,,,,,,,,,,,,,,,,,,,,,,,,
